*****PostgreSQL commands*****

** DATABASE**

1. Create Database : This will create a new database.
	Syntax: create database <database-name>;
	
    Example : postgres=# create database person;
              CREATE DATABASE

	a) \l -> To create a list of all databases created earlier.
	b) \c -> To connect a database.
		Syntax : \c <database-name>;

        Example : 
            postgres=# \c person;
            psql (15.3 (Ubuntu 15.3-1.pgdg18.04+1), server 10.23 (Ubuntu 10.23-0ubuntu0.18.04.2))
            You are now connected to database "person" as user "postgres".


2. Drop Database : To drop the database.
	Syntax : drop database <database-name>;

    Example : 
        postgres=# drop database person;
        DROP DATABASE


**TABLES**

3. Create Table : To create a new table in existing database.
	Syntax : create table <table-name>(<column1> <data-type> , <column2> <data type> , ..);
    
    Example :
        company=# create table employee (
        company(# emp_id int primary key,
        company(# emp_name varchar not null,
        company(# gender varchar );
        CREATE TABLE

	a) \d or \dt-> This command wil list all the tables in current database.

        Example :
            company=# \dt
                    List of relations
            Schema |   Name   | Type  |  Owner   
            --------+----------+-------+----------
            public | employee | table | postgres
            (1 row)

4. Drop table : To drop the table from database.
	Syntax: drop table <table-name>

    Example : 
        company=# drop table
5. Describe table : To find the information on columns of a table.
	Syntax : \d <table-name>

    Example :
        company=# \d employee
                    Table "public.employee"
        Column  |       Type        | Collation | Nullable | Default 
        ----------+-------------------+-----------+----------+---------
        emp_id   | integer           |           | not null | 
        emp_name | character varying |           | not null | 
        gender   | character varying |           |          | 
        Indexes:
            "employee_pkey" PRIMARY KEY, btree (emp_id)

6. alter table : This command is used to change the current table structure.
    Syntax : ALTER TABLE <table-name> action;  

    a) Add a column : To add a new column in existing table.
        Syntax: alter table <table-name> add column <column-name>;

        Example :
            company=# alter table employee add column address varchar(100);
            ALTER TABLE
    b) Rename a column : To rename the column name.
        Syntax : alter table <table-name> rename column <source_name> to <destination_name>;

        Example :
            company=# alter table employee rename column emp_name to name;
            ALTER TABLE
            company=# \d employee
                                Table "public.employee"
            Column  |          Type          | Collation | Nullable | Default 
            ---------+------------------------+-----------+----------+---------
            emp_id  | integer                |           | not null | 
            name    | character varying      |           | not null | 
            gender  | character varying      |           |          | 
            address | character varying(100) |           |          | 
            Indexes:
                "employee_pkey" PRIMARY KEY, btree (emp_id)
             c) Drop a column : To delete the column from a table.
        Syntax : alter table <table-name> drop column <column-name>;

        Example :
            company=# alter table employee drop column address;
            ALTER TABLE
    d) Change column type : To change the type of column.
        Syntax : alter table <table-name> alter column type <new-type>;

        Example :
            company=# alter table employee alter column gender type char(30);
            ALTER TABLE
    e) Add constraint on column : To add the new constraint on column.
        Syntax : alter table <table-name> alter column <column-name> set <constraint>;

        Example :
            company=# alter table employee alter column gender set not null;
            ALTER TABLE
    f) Drop constraint : To remove the constraint from column in a table.
        Syntax : alter table <table-name> alter column <column-name> drop <constraint>;
 
        Example :
            company=# alter table employee alter column gender drop not null;
            ALTER TABLE
    g) Add primary key constraint : To add primary key constraint in a column.
        Syntax : alter table <table-name> add primary key <column-name>;

        Example :
            company=# alter table person add primary key (id);
            ALTER TABLE
            company=# \d person
                                Table "public.person"
            Column |         Type          | Collation | Nullable | Default 
            --------+-----------------------+-----------+----------+---------
            id     | integer               |           | not null | 
            name   | character varying(30) |           |          | 
            Indexes:
                "person_pkey" PRIMARY KEY, btree (id)     
7. truncate table : The TRUNCATE TABLE command to remove all the records from a particular table.
    Syntax : truncate table <table-name>;

    Example :
        company=# truncate table person;
        TRUNCATE TABLE

8. Temporary table : This query is used to create the temporary table.
    Syntax : create temporary table <table-name>(...);

    Example:
        temporary_database=# create temporary table temp_table(fruits_name varchar,fruits_season varchar);
        CREATE TABLE
    
        a) drop temporary table : To drop the temporary table from database.
            Syntax : drop table <table-name>;
            Example :
                temporary_database=# drop table temp_table;
                DROP TABLE

        Note : If we close thse session then temporary table will automatically delete.

9. Column Aliases : Column alias is used to give a short name to the column.
    Syntax : select <column-name> as <alias-name> from <table-name>;

    Example : 
        company=# select id, name as person_name from person;
        id | person_name 
        ----+-------------
        (0 rows)
10. Insert Data : It is used to insert data into table.
    Syntax : insert into <table-name> (column1,...) values (data1,...);
    
    For multiple rows : 
    Syntax : insert into <table-name> (column1,...) values (data1,...),(data1,...),...;

    Example : 
        company=# insert into employee (emp_id,name,gender) values (3,'Shyam','male');
        INSERT 0 1
        company=# select * from employee;
        emp_id | name  |             gender             
        --------+-------+--------------------------------
            1 | Ram   | male                          
            2 | Kavya | female                        
            3 | Shyam | male                          
        (3 rows)
    
11. Select query : SELECT statement is used to fetch the data from a database table, which      returns data in the form of result table.
    Syntax : select <column_name> from <table-name>;
    
    For whole table :
    Syntax : select * from <table-name>;

    Example : 
        company=# select * from employee;
        emp_id | name  |             gender             
        --------+-------+--------------------------------
            1 | Ram   | male                          
            2 | Kavya | female                        
            3 | Shyam | male                          
        (3 rows)
12. Update query : The UPDATE command is used to change the present records in a table.
    Syntax : update <table-name> set <column-name>=<value> where <condition>;

    Example :
        company=# update employee SET name='Vijay' where emp_id=3;
        UPDATE 1
        company=# select * from employee;
        emp_id | name  |             gender             
        --------+-------+--------------------------------
            1 | Ram   | male                          
            2 | Kavya | female                        
            3 | Vijay | male                          
        (3 rows)

13. Delete query : It is used to delete all existing records from a table. And the WHERE clause is used to remove the selected records or else, all the data would be eliminated.
    Syntax : delete from <table-name> where <condition>;

    For deleting all rows from table:
    Syntax : delete from <table-name>;

    Example :   
        company=# delete from employee where emp_id=3;
        DELETE 1
        company=# select * from employee;
        emp_id | name  |             gender             
        --------+-------+--------------------------------
            1 | Ram   | male                          
            2 | Kavya | female                        
        (2 rows)

** CLAUSES IN POSTGRESQL **

14. Where clause : WHERE clause is used to specify a condition while fetching the data from single table or joining with multiple tables.
    Syntax : select column1,column2 from <table-name> 
            where <Condition>

    Example :
        company=# select * from employee where emp_id=2;
        emp_id | name  |             gender             
        --------+-------+--------------------------------
            2 | Kavya | female                        
        (1 row)                   
